{
  "definitions": {},
  "$schema": "http://json-schema.org/draft-07/schema#",
  "$id": "http://example.com/root.json",
  "type": "object",
  "title": "The Root Schema",
  "required": [
    "felles",
    "vanligBehandling",
    "klage",
    "anke",
    "innsyn"
  ],
  "properties": {
    "felles": {
      "type": "object"
    },
    "vanligBehandling": {
      "type": "boolean"
    },
    "klage": {
      "type": "boolean"
    },
    "anke": {
      "type": "boolean"
    },
    "innsyn": {
      "type": "boolean"
    },
    "opphavType": {
      "type": "string"
    }
  }
}
