{
  "felles": {
    "søkerNavn": "Dolly Duck",
    "søkerPersonnummer": "300220 12345",
    "brevDato": "4. april 2020",
    "saksnummer": "123456789",
    "ytelseType": "SVP",
    "behandlesAvKA": false
  },
  "vanligBehandling": false,
  "klage": true,
  "anke": false,
  "innsyn": false,
  "opphavType": "KLAGE"
}